[
  {
    "schema_id": "mini_summary.v1.1",
    "config_version": "router_v1.0.0",
    "trace_id": "trace_offline_0001",
    "agent": "preferences",
    "stable_id": 1,
    "source_block_ids": [
      "b001"
    ],
    "summary": "U: prefiero Linux para dev. A: OK.",
    "max_tokens": 40,
    "scores": {
      "match_query": 0.0,
      "recency": 0.0,
      "priority": 0.0,
      "score_global": 0.0
    }
  },
  {
    "schema_id": "mini_summary.v1.1",
    "config_version": "router_v1.0.0",
    "trace_id": "trace_offline_0001",
    "agent": "code",
    "stable_id": 1,
    "source_block_ids": [
      "b002"
    ],
    "summary": "U: here is some code: def x(): pass",
    "max_tokens": 40,
    "scores": {
      "match_query": 0.0,
      "recency": 0.0,
      "priority": 0.0,
      "score_global": 0.0
    }
  },
  {
    "schema_id": "mini_summary.v1.1",
    "config_version": "router_v1.0.0",
    "trace_id": "trace_offline_0001",
    "agent": "conversation",
    "stable_id": 1,
    "source_block_ids": [
      "b002"
    ],
    "summary": "A: ok",
    "max_tokens": 40,
    "scores": {
      "match_query": 0.0,
      "recency": 0.0,
      "priority": 0.0,
      "score_global": 0.0
    }
  }
]